{
  "$schema": "https://json-schema.org/draft/2020-12/schema",
  "$id": "https://ninfenz.local/schema/system-card.schema.json",
  "title": "AI 系统域 · 系统卡（模型无关的机验形态）",
  "description": "机制借鉴 Model Cards / Datasheets / NIST AI RMF 的**字段面**（逐条实证后取机制，不引外部文本作背书）：把「这个域包是什么 / 能做什么 / 不能做什么 / 怎么验的」写成有 schema 的数据。",
  "type": "object",
  "additionalProperties": false,
  "required": ["kind", "system", "intended_use", "limitations", "data", "evaluation",
               "human_oversight", "risk_management", "out_of_scope", "not_claims"],
  "properties": {
    "kind": {"const": "nf-system-card/1"},
    "system": {
      "type": "object",
      "additionalProperties": false,
      "required": ["id", "name", "version", "kind_of_system", "model_agnostic"],
      "properties": {
        "id": {"type": "string", "pattern": "^[A-Z0-9-]{3,}$"},
        "name": {"type": "string", "minLength": 1},
        "version": {"type": "string", "pattern": "^\\d+\\.\\d+\\.\\d+$"},
        "kind_of_system": {"enum": ["domain-package", "pipeline", "module", "runtime"]},
        "model_agnostic": {"type": "boolean"},
        "upstream_models": {"type": "array", "items": {"type": "string", "minLength": 1}}
      }
    },
    "intended_use": {
      "type": "object",
      "additionalProperties": false,
      "required": ["purpose", "consumers", "in_scope"],
      "properties": {
        "purpose": {"type": "string", "minLength": 8},
        "consumers": {"type": "array", "minItems": 1, "items": {"type": "string", "minLength": 1}},
        "in_scope": {"type": "array", "minItems": 1, "items": {"type": "string", "minLength": 1}}
      }
    },
    "limitations": {"type": "array", "minItems": 1,
                    "items": {"type": "string", "minLength": 8}},
    "data": {
      "type": "object",
      "additionalProperties": false,
      "required": ["sources", "provenance_policy", "personal_data"],
      "properties": {
        "sources": {"type": "array", "minItems": 1,
                    "items": {"type": "object", "additionalProperties": false,
                              "required": ["id", "kind", "note"],
                              "properties": {
                                "id": {"type": "string", "minLength": 1},
                                "kind": {"enum": ["self-authored", "external-structure",
                                                 "repository-artifact", "generated"]},
                                "note": {"type": "string", "minLength": 3}
                              }}},
        "provenance_policy": {"type": "string", "minLength": 8},
        "personal_data": {"enum": ["none", "synthetic-only", "unknown"]}
      }
    },
    "evaluation": {
      "type": "object",
      "additionalProperties": false,
      "required": ["method", "faces", "reproduce_command", "not_measured"],
      "properties": {
        "method": {"type": "string", "minLength": 8},
        "faces": {"type": "array", "minItems": 1,
                  "items": {"type": "object", "additionalProperties": false,
                            "required": ["name", "gate", "result"],
                            "properties": {
                              "name": {"type": "string", "minLength": 2},
                              "gate": {"type": "string", "minLength": 2},
                              "result": {"type": "string", "minLength": 1}
                            }}},
        "reproduce_command": {"type": "string", "minLength": 4},
        "not_measured": {"type": "array", "minItems": 1,
                         "items": {"type": "string", "minLength": 4}}
      }
    },
    "human_oversight": {"type": "array", "minItems": 1,
                        "items": {"type": "string", "minLength": 8}},
    "risk_management": {
      "type": "object",
      "additionalProperties": false,
      "required": ["framework", "functions", "residual_risks"],
      "properties": {
        "framework": {"enum": ["NIST AI RMF 1.0", "ISO/IEC 42001", "none-declared"]},
        "functions": {
          "type": "object",
          "additionalProperties": false,
          "required": ["GOVERN", "MAP", "MEASURE", "MANAGE"],
          "properties": {
            "GOVERN": {"type": "array", "minItems": 1, "items": {"type": "string", "minLength": 3}},
            "MAP": {"type": "array", "minItems": 1, "items": {"type": "string", "minLength": 3}},
            "MEASURE": {"type": "array", "minItems": 1, "items": {"type": "string", "minLength": 3}},
            "MANAGE": {"type": "array", "minItems": 1, "items": {"type": "string", "minLength": 3}}
          }
        },
        "residual_risks": {"type": "array", "minItems": 1,
                           "items": {"type": "string", "minLength": 8}}
      }
    },
    "out_of_scope": {"type": "array", "minItems": 1,
                     "items": {"type": "string", "minLength": 4}},
    "not_claims": {"type": "array", "minItems": 1,
                   "items": {"type": "string", "minLength": 8}}
  }
}
